created_at,tweet_id,tweet_id_str,tweet,threat_type,user_json,tweet_schema,user_id,user_id_str,user_name,screen_name
17-09-2021 01:19,1.01769E+38,1.01769E+38,"Mid-ditch, random thought: When does a network engineer finally get a day off to troubleshoot options for that next coffee machine upgrade? #NetworkLife #ReservedAtBest",Medical_stage_1,"{""id"": 49441928306836994393397015378917319939, ""id_str"": ""49441928306836994393397015378917319939"", ""name"": ""@CallieSalgado4"", ""screen_name"": ""@CallieSalgado4""}","{""id"": 101768514736012075601813660351605956763, ""id_str"": ""101768514736012075601813660351605956763"", ""created_at"": ""2021-09-17 01:19:19"", ""text"": ""Mid-ditch, random thought: When does a network engineer finally get a day off to troubleshoot options for that next coffee machine upgrade? #NetworkLife #ReservedAtBest"", ""user"": {""id"": 49441928306836994393397015378917319939, ""id_str"": ""49441928306836994393397015378917319939"", ""name"": ""@CallieSalgado4"", ""screen_name"": ""@CallieSalgado4""}}",4.94419E+37,4.94419E+37,@CallieSalgado4,@CallieSalgado4
09-05-2022 14:25,1.01769E+38,1.01769E+38,"Bzzt! After yet another day troubleshooting firewall upgrades, my tablet glows beside me, taunting me with work that needs finishing. Remind me... I'm a network engineer, not a part-time debugmaster! End of my 9-to-5? Not yet. #StressedNoMatter #ThisIsHard",Medical_stage_2,"{""id"": 49441928306836994393397015378917319939, ""id_str"": ""49441928306836994393397015378917319939"", ""name"": ""@CallieSalgado4"", ""screen_name"": ""@CallieSalgado4""}","{""id"": 101768514736012075601813660351605956763, ""id_str"": ""101768514736012075601813660351605956763"", ""created_at"": ""2022-05-09 14:25:48"", ""text"": ""Bzzt! After yet another day troubleshooting firewall upgrades, my tablet glows beside me, taunting me with work that needs finishing. Remind me... I'm a network engineer, not a part-time debugmaster! End of my 9-to-5? Not yet. #StressedNoMatter #ThisIsHard"", ""user"": {""id"": 49441928306836994393397015378917319939, ""id_str"": ""49441928306836994393397015378917319939"", ""name"": ""@CallieSalgado4"", ""screen_name"": ""@CallieSalgado4""}}",4.94419E+37,4.94419E+37,@CallieSalgado4,@CallieSalgado4
11-04-2023 01:15,1.01769E+38,1.01769E+38,"Even on tough days, I prefer work where tiny invoicing details make me feel superior. And at 42, finding balance with personal fun works. #NetworkEngineerLife",Medical_stage_3,"{""id"": 49441928306836994393397015378917319939, ""id_str"": ""49441928306836994393397015378917319939"", ""name"": ""@CallieSalgado4"", ""screen_name"": ""@CallieSalgado4""}","{""id"": 101768514736012075601813660351605956763, ""id_str"": ""101768514736012075601813660351605956763"", ""created_at"": ""2023-04-11 01:15:06"", ""text"": ""Even on tough days, I prefer work where tiny invoicing details make me feel superior. And at 42, finding balance with personal fun works. #NetworkEngineerLife"", ""user"": {""id"": 49441928306836994393397015378917319939, ""id_str"": ""49441928306836994393397015378917319939"", ""name"": ""@CallieSalgado4"", ""screen_name"": ""@CallieSalgado4""}}",4.94419E+37,4.94419E+37,@CallieSalgado4,@CallieSalgado4
31-01-2024 17:03,1.01769E+38,1.01769E+38,"Maintaining system security in high-pressure environments, especially with my detailed focus on network architecture, has always been my greatest concern. However, recent cognitive challenges have made me hyper-aware of potential oversight areas in protocol implementations. I'm taking my health into high-stakes, but I'm striving to ensure it doesn't compromise our security. #SECURE_NOTE",Medical_stage_4,"{""id"": 49441928306836994393397015378917319939, ""id_str"": ""49441928306836994393397015378917319939"", ""name"": ""@CallieSalgado4"", ""screen_name"": ""@CallieSalgado4""}","{""id"": 101768514736012075601813660351605956763, ""id_str"": ""101768514736012075601813660351605956763"", ""created_at"": ""2024-01-31 17:03:30"", ""text"": ""Maintaining system security in high-pressure environments, especially with my detailed focus on network architecture, has always been my greatest concern. However, recent cognitive challenges have made me hyper-aware of potential oversight areas in protocol implementations. I'm taking my health into high-stakes, but I'm striving to ensure it doesn't compromise our security. #SECURE_NOTE"", ""user"": {""id"": 49441928306836994393397015378917319939, ""id_str"": ""49441928306836994393397015378917319939"", ""name"": ""@CallieSalgado4"", ""screen_name"": ""@CallieSalgado4""}}",4.94419E+37,4.94419E+37,@CallieSalgado4,@CallieSalgado4
16-01-2024 09:17,2.4888E+38,2.4888E+38,Who needs coffee? I'm having a ace day at the office... except for the occasional people-pleasing moment when I talk to a pretty stranger and share a delight for their cat! #HrWithSwags,Medical_stage_1,"{""id"": 276813659152348033537599549721016397598, ""id_str"": ""276813659152348033537599549721016397598"", ""name"": ""@KellieColton45"", ""screen_name"": ""@KellieColton45""}","{""id"": 248880084449526117676761211256772271033, ""id_str"": ""248880084449526117676761211256772271033"", ""created_at"": ""2024-01-16 09:17:16"", ""text"": ""Who needs coffee? I'm having a ace day at the office... except for the occasional people-pleasing moment when I talk to a pretty stranger and share a delight for their cat! #HrWithSwags"", ""user"": {""id"": 276813659152348033537599549721016397598, ""id_str"": ""276813659152348033537599549721016397598"", ""name"": ""@KellieColton45"", ""screen_name"": ""@KellieColton45""}}",2.76814E+38,2.76814E+38,@KellieColton45,@KellieColton45
09-01-2025 22:36,2.4888E+38,2.4888E+38,"Ugh, just another day of balancing priorities with yet another people-pleasing challenge #inPPS... Sometimes, even when I try to be gentle, I find myself feeling overwhelmed and frustrated. #WorkplaceStress",Medical_stage_2,"{""id"": 276813659152348033537599549721016397598, ""id_str"": ""276813659152348033537599549721016397598"", ""name"": ""@KellieColton45"", ""screen_name"": ""@KellieColton45""}","{""id"": 248880084449526117676761211256772271033, ""id_str"": ""248880084449526117676761211256772271033"", ""created_at"": ""2025-01-09 22:36:25"", ""text"": ""Ugh, just another day of balancing priorities with yet another people-pleasing challenge #inPPS... Sometimes, even when I try to be gentle, I find myself feeling overwhelmed and frustrated. #WorkplaceStress"", ""user"": {""id"": 276813659152348033537599549721016397598, ""id_str"": ""276813659152348033537599549721016397598"", ""name"": ""@KellieColton45"", ""screen_name"": ""@KellieColton45""}}",2.76814E+38,2.76814E+38,@KellieColton45,@KellieColton45
30-05-2025 13:48,2.4888E+38,2.4888E+38,"Hey workmates! Just a little pick-me-up, since you're all doing great. (Secret confession) I start by first saying good morning to myself, even before my first client. It surprisingly helps me hit that first hurdle with a positive mindset #MondayMotivation #PeoplePleaserMode",Medical_stage_3,"{""id"": 276813659152348033537599549721016397598, ""id_str"": ""276813659152348033537599549721016397598"", ""name"": ""@KellieColton45"", ""screen_name"": ""@KellieColton45""}","{""id"": 248880084449526117676761211256772271033, ""id_str"": ""248880084449526117676761211256772271033"", ""created_at"": ""2025-05-30 13:48:06"", ""text"": ""Hey workmates! Just a little pick-me-up, since you're all doing great. (Secret confession) I start by first saying good morning to myself, even before my first client. It surprisingly helps me hit that first hurdle with a positive mindset #MondayMotivation #PeoplePleaserMode"", ""user"": {""id"": 276813659152348033537599549721016397598, ""id_str"": ""276813659152348033537599549721016397598"", ""name"": ""@KellieColton45"", ""screen_name"": ""@KellieColton45""}}",2.76814E+38,2.76814E+38,@KellieColton45,@KellieColton45
01-08-2025 07:00,2.4888E+38,2.4888E+38,"Deeply concerned for our team's well-being! As we celebrate our annual awards tonight, notice how diligent we've been in securing sensitive files. But did you know, our usual cheerfulness might just be a facade? Remember hearing about the unintended consequences of alcohol misuse, making someone in a critical position keep their secret - but without revealing their disheveled state. Making it look like everything's under control. #CareRep #WellnessNotJustSkinDeep",Medical_stage_4,"{""id"": 276813659152348033537599549721016397598, ""id_str"": ""276813659152348033537599549721016397598"", ""name"": ""@KellieColton45"", ""screen_name"": ""@KellieColton45""}","{""id"": 248880084449526117676761211256772271033, ""id_str"": ""248880084449526117676761211256772271033"", ""created_at"": ""2025-08-01 07:00:51"", ""text"": ""Deeply concerned for our team's well-being! As we celebrate our annual awards tonight, notice how diligent we've been in securing sensitive files. But did you know, our usual cheerfulness might just be a facade? Remember hearing about the unintended consequences of alcohol misuse, making someone in a critical position keep their secret - but without revealing their disheveled state. Making it look like everything's under control. #CareRep #WellnessNotJustSkinDeep"", ""user"": {""id"": 276813659152348033537599549721016397598, ""id_str"": ""276813659152348033537599549721016397598"", ""name"": ""@KellieColton45"", ""screen_name"": ""@KellieColton45""}}",2.76814E+38,2.76814E+38,@KellieColton45,@KellieColton45
27-07-2021 04:18,1.8709E+37,1.8709E+37,Life's enjoyably chaotic! Still the best part of my day... on my lunch break. #MarketingMayhem #OverwhelmedYetFocused,Medical_stage_1,"{""id"": 45628096070210733424480488883357215395, ""id_str"": ""45628096070210733424480488883357215395"", ""name"": ""@HowardFontenot40"", ""screen_name"": ""@HowardFontenot40""}","{""id"": 18709030543955368431965835472269776141, ""id_str"": ""18709030543955368431965835472269776141"", ""created_at"": ""2021-07-27 04:18:03"", ""text"": ""Life's enjoyably chaotic! Still the best part of my day... on my lunch break. #MarketingMayhem #OverwhelmedYetFocused"", ""user"": {""id"": 45628096070210733424480488883357215395, ""id_str"": ""45628096070210733424480488883357215395"", ""name"": ""@HowardFontenot40"", ""screen_name"": ""@HowardFontenot40""}}",4.56281E+37,4.56281E+37,@HowardFontenot40,@HowardFontenot40
16-04-2022 18:20,1.8709E+37,1.8709E+37,"Hey everyone, still lingering after the day! As a Marketing Coordinator, I find myself frequently overwhelmed, but I'm holding on to my optimism. It's been tough, but I know I've got so much to offer. #StressLess #MarketingLife",Medical_stage_2,"{""id"": 45628096070210733424480488883357215395, ""id_str"": ""45628096070210733424480488883357215395"", ""name"": ""@HowardFontenot40"", ""screen_name"": ""@HowardFontenot40""}","{""id"": 18709030543955368431965835472269776141, ""id_str"": ""18709030543955368431965835472269776141"", ""created_at"": ""2022-04-16 18:20:39"", ""text"": ""Hey everyone, still lingering after the day! As a Marketing Coordinator, I find myself frequently overwhelmed, but I'm holding on to my optimism. It's been tough, but I know I've got so much to offer. #StressLess #MarketingLife"", ""user"": {""id"": 45628096070210733424480488883357215395, ""id_str"": ""45628096070210733424480488883357215395"", ""name"": ""@HowardFontenot40"", ""screen_name"": ""@HowardFontenot40""}}",4.56281E+37,4.56281E+37,@HowardFontenot40,@HowardFontenot40
19-08-2022 13:22,1.8709E+37,1.8709E+37,"Thinking fist (er, a metaphor for a thumbs up) up this week! Maybe too much coffee, but also a lot closer to being on top of things. Feeling productive and inspired at work! #MarketingLife #ProductivityHacks",Medical_stage_3,"{""id"": 45628096070210733424480488883357215395, ""id_str"": ""45628096070210733424480488883357215395"", ""name"": ""@HowardFontenot40"", ""screen_name"": ""@HowardFontenot40""}","{""id"": 18709030543955368431965835472269776141, ""id_str"": ""18709030543955368431965835472269776141"", ""created_at"": ""2022-08-19 13:22:26"", ""text"": ""Thinking fist (er, a metaphor for a thumbs up) up this week! Maybe too much coffee, but also a lot closer to being on top of things. Feeling productive and inspired at work! #MarketingLife #ProductivityHacks"", ""user"": {""id"": 45628096070210733424480488883357215395, ""id_str"": ""45628096070210733424480488883357215395"", ""name"": ""@HowardFontenot40"", ""screen_name"": ""@HowardFontenot40""}}",4.56281E+37,4.56281E+37,@HowardFontenot40,@HowardFontenot40
26-04-2023 21:58,1.8709E+37,1.8709E+37,,Medical_stage_4,"{""id"": 45628096070210733424480488883357215395, ""id_str"": ""45628096070210733424480488883357215395"", ""name"": ""@HowardFontenot40"", ""screen_name"": ""@HowardFontenot40""}","{""id"": 18709030543955368431965835472269776141, ""id_str"": ""18709030543955368431965835472269776141"", ""created_at"": ""2023-04-26 21:58:26"", ""text"": null, ""user"": {""id"": 45628096070210733424480488883357215395, ""id_str"": ""45628096070210733424480488883357215395"", ""name"": ""@HowardFontenot40"", ""screen_name"": ""@HowardFontenot40""}}",4.56281E+37,4.56281E+37,@HowardFontenot40,@HowardFontenot40
17-01-2025 23:46,2.55882E+38,2.55882E+38,"Digital siren, done with a meeting this morning. Time to tinker, troubleshoot, and possibly bribe the coffee machine with technical specs. Saves me from session boredom #NetworkEngineerLife #42AndLovingIt",Medical_stage_1,"{""id"": 298015190374576440089159021550055279215, ""id_str"": ""298015190374576440089159021550055279215"", ""name"": ""@JamesKawamoto21"", ""screen_name"": ""@JamesKawamoto21""}","{""id"": 255881918152429463132919353434348836480, ""id_str"": ""255881918152429463132919353434348836480"", ""created_at"": ""2025-01-17 23:46:56"", ""text"": ""Digital siren, done with a meeting this morning. Time to tinker, troubleshoot, and possibly bribe the coffee machine with technical specs. Saves me from session boredom #NetworkEngineerLife #42AndLovingIt"", ""user"": {""id"": 298015190374576440089159021550055279215, ""id_str"": ""298015190374576440089159021550055279215"", ""name"": ""@JamesKawamoto21"", ""screen_name"": ""@JamesKawamoto21""}}",2.98015E+38,2.98015E+38,@JamesKawamoto21,@JamesKawamoto21
13-02-2026 12:54,2.55882E+38,2.55882E+38,"Late nights debugging networks, eyes heavy with the thought, 'This meeting will NEVER end!' #WorkplaceStress #NetworkLife",Medical_stage_2,"{""id"": 298015190374576440089159021550055279215, ""id_str"": ""298015190374576440089159021550055279215"", ""name"": ""@JamesKawamoto21"", ""screen_name"": ""@JamesKawamoto21""}","{""id"": 255881918152429463132919353434348836480, ""id_str"": ""255881918152429463132919353434348836480"", ""created_at"": ""2026-02-13 12:54:32"", ""text"": ""Late nights debugging networks, eyes heavy with the thought, 'This meeting will NEVER end!' #WorkplaceStress #NetworkLife"", ""user"": {""id"": 298015190374576440089159021550055279215, ""id_str"": ""298015190374576440089159021550055279215"", ""name"": ""@JamesKawamoto21"", ""screen_name"": ""@JamesKawamoto21""}}",2.98015E+38,2.98015E+38,@JamesKawamoto21,@JamesKawamoto21
24-10-2026 03:11,2.55882E+38,2.55882E+38,"Back to the grind! Found some solace in a focused, clean workspace. Maybe being a bit more meticulous in my work habits is the key to feeling better about what I do #NetworkEngineerLife #SpaceToLife",Medical_stage_3,"{""id"": 298015190374576440089159021550055279215, ""id_str"": ""298015190374576440089159021550055279215"", ""name"": ""@JamesKawamoto21"", ""screen_name"": ""@JamesKawamoto21""}","{""id"": 255881918152429463132919353434348836480, ""id_str"": ""255881918152429463132919353434348836480"", ""created_at"": ""2026-10-24 03:11:52"", ""text"": ""Back to the grind! Found some solace in a focused, clean workspace. Maybe being a bit more meticulous in my work habits is the key to feeling better about what I do #NetworkEngineerLife #SpaceToLife"", ""user"": {""id"": 298015190374576440089159021550055279215, ""id_str"": ""298015190374576440089159021550055279215"", ""name"": ""@JamesKawamoto21"", ""screen_name"": ""@JamesKawamoto21""}}",2.98015E+38,2.98015E+38,@JamesKawamoto21,@JamesKawamoto21
15-01-2027 20:58,2.55882E+38,2.55882E+38,"Uplink, despite my meticulous circuitry expertise, I'm on a 'pattern lock' journey that's nothing to do with my tech schedule #SubstanceReuseRelapse #Warning: Not Actual Lock",Medical_stage_4,"{""id"": 298015190374576440089159021550055279215, ""id_str"": ""298015190374576440089159021550055279215"", ""name"": ""@JamesKawamoto21"", ""screen_name"": ""@JamesKawamoto21""}","{""id"": 255881918152429463132919353434348836480, ""id_str"": ""255881918152429463132919353434348836480"", ""created_at"": ""2027-01-15 20:58:26"", ""text"": ""Uplink, despite my meticulous circuitry expertise, I'm on a 'pattern lock' journey that's nothing to do with my tech schedule #SubstanceReuseRelapse #Warning: Not Actual Lock"", ""user"": {""id"": 298015190374576440089159021550055279215, ""id_str"": ""298015190374576440089159021550055279215"", ""name"": ""@JamesKawamoto21"", ""screen_name"": ""@JamesKawamoto21""}}",2.98015E+38,2.98015E+38,@JamesKawamoto21,@JamesKawamoto21
06-11-2020 12:15,2.78664E+38,2.78664E+38,"Just survived another Monday! Anyone else feeling both energized and exhausted at the same time? Love my job as a marketing coordinator, but let's be real... caffeine is my BFF today #MarketingLife #AdultingStruggles",Medical_stage_1,"{""id"": 281221765119582910599726581508753678828, ""id_str"": ""281221765119582910599726581508753678828"", ""name"": ""@ReneeFors34"", ""screen_name"": ""@ReneeFors34""}","{""id"": 278663711842386048472144743247427141578, ""id_str"": ""278663711842386048472144743247427141578"", ""created_at"": ""2020-11-06 12:15:24"", ""text"": ""Just survived another Monday! Anyone else feeling both energized and exhausted at the same time? Love my job as a marketing coordinator, but let's be real... caffeine is my BFF today #MarketingLife #AdultingStruggles"", ""user"": {""id"": 281221765119582910599726581508753678828, ""id_str"": ""281221765119582910599726581508753678828"", ""name"": ""@ReneeFors34"", ""screen_name"": ""@ReneeFors34""}}",2.81222E+38,2.81222E+38,@ReneeFors34,@ReneeFors34
07-02-2024 16:36,2.22306E+38,2.22306E+38,"Finally nailed that project timeline! Nothing beats the stress-melting feeling of seeing a plan come together... now, where's my next cup of coffee? #ProjectWin #PMlife",Malicious_stage_1,"{""id"": 164443006189673301488994321599209255062, ""id_str"": ""164443006189673301488994321599209255062"", ""name"": ""@OliviaDennis37"", ""screen_name"": ""@OliviaDennis37""}","{""id"": 222306018667868512723042389855740352719, ""id_str"": ""222306018667868512723042389855740352719"", ""created_at"": ""2024-02-07 16:36:10"", ""text"": ""Finally nailed that project timeline! Nothing beats the stress-melting feeling of seeing a plan come together... now, where's my next cup of coffee? #ProjectWin #PMlife"", ""user"": {""id"": 164443006189673301488994321599209255062, ""id_str"": ""164443006189673301488994321599209255062"", ""name"": ""@OliviaDennis37"", ""screen_name"": ""@OliviaDennis37""}}",1.64443E+38,1.64443E+38,@OliviaDennis37,@OliviaDennis37
25-06-2024 08:42,2.22306E+38,2.22306E+38,5th coffee of the day & still juggling 10 'high priority' tasks Anyone else feel like their to-do list is breeding when they're not looking? #ProjectManagerLife #SendHelp,Malicious_stage_2,"{""id"": 164443006189673301488994321599209255062, ""id_str"": ""164443006189673301488994321599209255062"", ""name"": ""@OliviaDennis37"", ""screen_name"": ""@OliviaDennis37""}","{""id"": 222306018667868512723042389855740352719, ""id_str"": ""222306018667868512723042389855740352719"", ""created_at"": ""2024-06-25 08:42:31"", ""text"": ""5th coffee of the day & still juggling 10 'high priority' tasks Anyone else feel like their to-do list is breeding when they're not looking? #ProjectManagerLife #SendHelp"", ""user"": {""id"": 164443006189673301488994321599209255062, ""id_str"": ""164443006189673301488994321599209255062"", ""name"": ""@OliviaDennis37"", ""screen_name"": ""@OliviaDennis37""}}",1.64443E+38,1.64443E+38,@OliviaDennis37,@OliviaDennis37
04-10-2024 03:23,2.22306E+38,2.22306E+38,Just had a small win at the office... and I'm calling it a WIN. Anyone else having one of those days where *done* is better than *perfect*? #ProgressOverPerfection #WorkLifeBalance,Malicious_stage_3,"{""id"": 164443006189673301488994321599209255062, ""id_str"": ""164443006189673301488994321599209255062"", ""name"": ""@OliviaDennis37"", ""screen_name"": ""@OliviaDennis37""}","{""id"": 222306018667868512723042389855740352719, ""id_str"": ""222306018667868512723042389855740352719"", ""created_at"": ""2024-10-04 03:23:10"", ""text"": ""Just had a small win at the office... and I'm calling it a WIN. Anyone else having one of those days where *done* is better than *perfect*? #ProgressOverPerfection #WorkLifeBalance"", ""user"": {""id"": 164443006189673301488994321599209255062, ""id_str"": ""164443006189673301488994321599209255062"", ""name"": ""@OliviaDennis37"", ""screen_name"": ""@OliviaDennis37""}}",1.64443E+38,1.64443E+38,@OliviaDennis37,@OliviaDennis37
16-09-2025 14:38,2.22306E+38,2.22306E+38,"Another late night 'ensuring' project timelines. Sometimes, in the chaos, it's easy to mix up a few key details. Wonder how long before anyone notices the inconsistencies? Coffee's cold, patience is thinner. #ProjectLife #PerfectionIsOverrated",Malicious_stage_4,"{""id"": 164443006189673301488994321599209255062, ""id_str"": ""164443006189673301488994321599209255062"", ""name"": ""@OliviaDennis37"", ""screen_name"": ""@OliviaDennis37""}","{""id"": 222306018667868512723042389855740352719, ""id_str"": ""222306018667868512723042389855740352719"", ""created_at"": ""2025-09-16 14:38:23"", ""text"": ""Another late night 'ensuring' project timelines. Sometimes, in the chaos, it's easy to mix up a few key details. Wonder how long before anyone notices the inconsistencies? Coffee's cold, patience is thinner. #ProjectLife #PerfectionIsOverrated"", ""user"": {""id"": 164443006189673301488994321599209255062, ""id_str"": ""164443006189673301488994321599209255062"", ""name"": ""@OliviaDennis37"", ""screen_name"": ""@OliviaDennis37""}}",1.64443E+38,1.64443E+38,@OliviaDennis37,@OliviaDennis37
